{
  "id": "evidence",
  "runId": "run",
  "taskId": "task",
  "taskRevision": 1,
  "leaseGeneration": 1,
  "gateId": "unit",
  "repositoryIdentity": "3333333333333333333333333333333333333333333333333333333333333333",
  "treeHash": "aaaaaaaaaaaaaaaaaaaaaaaaaaaaaaaaaaaaaaaaaaaaaaaaaaaaaaaaaaaaaaaa",
  "inputTreeHash": "bbbbbbbbbbbbbbbbbbbbbbbbbbbbbbbbbbbbbbbbbbbbbbbbbbbbbbbbbbbbbbbb",
  "writeSurfaceHash": "cccccccccccccccccccccccccccccccccccccccccccccccccccccccccccccccc",
  "inputWriteSurfaceHash": "dddddddddddddddddddddddddddddddddddddddddddddddddddddddddddddddd",
  "operationFingerprint": "eeeeeeeeeeeeeeeeeeeeeeeeeeeeeeeeeeeeeeeeeeeeeeeeeeeeeeeeeeeeeeee",
  "executionFingerprint": "ffffffffffffffffffffffffffffffffffffffffffffffffffffffffffffffff",
  "artifactHashes": ["1111111111111111111111111111111111111111111111111111111111111111"],
  "timestamp": "2099-01-01T00:00:00.000Z",
  "gateDefinitionHash": "2222222222222222222222222222222222222222222222222222222222222222",
  "exitCode": 0,
  "runStatus": "succeeded",
  "startedAt": "2099-01-01T00:00:00.000Z",
  "finishedAt": "2099-01-01T00:00:01.000Z",
  "durationMs": 1000,
  "stdoutLogPath": ".leo-dev/runtime/c-run/stdout.log",
  "stderrLogPath": ".leo-dev/runtime/c-run/stderr.log"
}
